laureate_id,laureate_name,gender,award_year,category,motivation_en,affiliation_name,affiliation_city,affiliation_country,affiliation_type,count
1,Wilhelm Conrad Röntgen,male,1901,Physics,in recognition of the extraordinary services he has rendered by the discovery of the remarkable rays subsequently named after him,Munich University,Munich,Germany,university,1
2,Hendrik Antoon Lorentz,male,1902,Physics,in recognition of the extraordinary service they rendered by their researches into the influence of magnetism upon radiation phenomena,Leiden University,Leiden,Netherlands,university,1
3,Pieter Zeeman,male,1902,Physics,in recognition of the extraordinary service they rendered by their researches into the influence of magnetism upon radiation phenomena,Amsterdam University,Amsterdam,Netherlands,university,1
4,Antoine Henri Becquerel,male,1903,Physics,in recognition of the extraordinary services he has rendered by his discovery of spontaneous radioactivity,École Polytechnique,Paris,France,other,1
5,Pierre Curie,male,1903,Physics,in recognition of the extraordinary services they have rendered by their joint researches on the radiation phenomena discovered by Professor Henri Becquerel,École municipale de physique et de chimie industrielles (Municipal School of Industrial Physics and Chemistry),Paris,France,university,1
6,"Marie Curie, née Skłodowska",female,1903,Physics,in recognition of the extraordinary services they have rendered by their joint researches on the radiation phenomena discovered by Professor Henri Becquerel,,,,unknown,1
6,"Marie Curie, née Skłodowska",female,1911,Chemistry,"in recognition of her services to the advancement of chemistry by the discovery of the elements radium and polonium, by the isolation of radium and the study of the nature and compounds of this remarkable element",Sorbonne University,Paris,France,university,1
8,Lord Rayleigh (John William Strutt),male,1904,Physics,for his investigations of the densities of the most important gases and for his discovery of argon in connection with these studies,Royal Institution of Great Britain,London,United Kingdom,government,1
9,Philipp Eduard Anton von Lenard,male,1905,Physics,for his work on cathode rays,Kiel University,Kiel,Germany,university,1
10,Joseph John Thomson,male,1906,Physics,in recognition of the great merits of his theoretical and experimental investigations on the conduction of electricity by gases,University of Cambridge,Cambridge,United Kingdom,university,1
11,Albert Abraham Michelson,male,1907,Physics,for his optical precision instruments and the spectroscopic and metrological investigations carried out with their aid,University of Chicago,"Chicago, IL",United States,university,1
12,Gabriel Lippmann,male,1908,Physics,for his method of reproducing colours photographically based on the phenomenon of interference,Sorbonne University,Paris,France,university,1
13,Guglielmo Marconi,male,1909,Physics,in recognition of their contributions to the development of wireless telegraphy,Marconi Wireless Telegraph Co. Ltd.,London,United Kingdom,company,1
14,Karl Ferdinand Braun,male,1909,Physics,in recognition of their contributions to the development of wireless telegraphy,Strasbourg University,Strasbourg,France,university,1
15,Johannes Diderik van der Waals,male,1910,Physics,for his work on the equation of state for gases and liquids,Amsterdam University,Amsterdam,Netherlands,university,1
16,Wilhelm Wien,male,1911,Physics,for his discoveries regarding the laws governing the radiation of heat,Würzburg University,Würzburg,Germany,university,1
17,Nils Gustaf Dalén,male,1912,Physics,for his invention of automatic regulators for use in conjunction with gas accumulators for illuminating lighthouses and buoys,Swedish Gas-Accumulator Co.,"Lidingö, Stockholm",Sweden,other,1
18,Heike Kamerlingh Onnes,male,1913,Physics,"for his investigations on the properties of matter at low temperatures which led, inter alia, to the production of liquid helium",Leiden University,Leiden,Netherlands,university,1
19,Max von Laue,male,1914,Physics,for his discovery of the diffraction of X-rays by crystals,Frankfurt-on-the-Main University,Frankfurt-on-the-Main,Germany,university,1
20,Sir William Henry Bragg,male,1915,Physics,for their services in the analysis of crystal structure by means of X-rays,University College,London,United Kingdom,university,1
21,William Lawrence Bragg,male,1915,Physics,for their services in the analysis of crystal structure by means of X-rays,Victoria University,Manchester,United Kingdom,university,1
22,Charles Glover Barkla,male,1917,Physics,for his discovery of the characteristic R&ouml;ntgen radiation of the elements,Edinburgh University,Edinburgh,United Kingdom,university,1
23,Max Karl Ernst Ludwig Planck,male,1918,Physics,in recognition of the services he rendered to the advancement of Physics by his discovery of energy quanta,Berlin University,Berlin,Germany,university,1
24,Johannes Stark,male,1919,Physics,for his discovery of the Doppler effect in canal rays and the splitting of spectral lines in electric fields,Greifswald University,Greifswald,Germany,university,1
25,Charles Edouard Guillaume,male,1920,Physics,in recognition of the service he has rendered to precision measurements in Physics by his discovery of anomalies in nickel steel alloys,Bureau International des Poids et Mesures (International Bureau of Weights and Measures),Sèvres,France,other,1
26,Albert Einstein,male,1921,Physics,"for his services to Theoretical Physics, and especially for his discovery of the law of the photoelectric effect",Kaiser-Wilhelm-Institut (now Max-Planck-Institut) für Physik,Berlin,Germany,other,1
27,Niels Henrik David Bohr,male,1922,Physics,for his services in the investigation of the structure of atoms and of the radiation emanating from them,Copenhagen University,Copenhagen,Denmark,university,1
28,Robert Andrews Millikan,male,1923,Physics,for his work on the elementary charge of electricity and on the photoelectric effect,California Institute of Technology (Caltech),"Pasadena, CA",United States,university,1
29,Karl Manne Georg Siegbahn,male,1924,Physics,for his discoveries and research in the field of X-ray spectroscopy,Uppsala University,Uppsala,Sweden,university,1
30,James Franck,male,1925,Physics,for their discovery of the laws governing the impact of an electron upon an atom,Goettingen University,Göttingen,Germany,university,1
31,Gustav Ludwig Hertz,male,1925,Physics,for their discovery of the laws governing the impact of an electron upon an atom,Halle University,Halle,Germany,university,1
32,Jean Baptiste Perrin,male,1926,Physics,"for his work on the discontinuous structure of matter, and especially for his discovery of sedimentation equilibrium",Sorbonne University,Paris,France,university,1
33,Arthur Holly Compton,male,1927,Physics,for his discovery of the effect named after him,University of Chicago,"Chicago, IL",United States,university,1
34,Charles Thomson Rees Wilson,male,1927,Physics,for his method of making the paths of electrically charged particles visible by condensation of vapour,University of Cambridge,Cambridge,United Kingdom,university,1
35,Owen Willans Richardson,male,1928,Physics,for his work on the thermionic phenomenon and especially for the discovery of the law named after him,London University,London,United Kingdom,university,1
36,Prince Louis-Victor Pierre Raymond de Broglie,male,1929,Physics,for his discovery of the wave nature of electrons,"Sorbonne University, Institut Henri Poincaré",Paris,France,university,1
37,Sir Chandrasekhara Venkata Raman,male,1930,Physics,for his work on the scattering of light and for the discovery of the effect named after him,Calcutta University,Calcutta,India,university,1
38,Werner Karl Heisenberg,male,1932,Physics,"for the creation of quantum mechanics, the application of which has, inter alia, led to the discovery of the allotropic forms of hydrogen",Leipzig University,Leipzig,Germany,university,1
39,Erwin Schrödinger,male,1933,Physics,for the discovery of new productive forms of atomic theory,Berlin University,Berlin,Germany,university,1
40,Paul Adrien Maurice Dirac,male,1933,Physics,for the discovery of new productive forms of atomic theory,University of Cambridge,Cambridge,United Kingdom,university,1
41,James Chadwick,male,1935,Physics,for the discovery of the neutron,Liverpool University,Liverpool,United Kingdom,university,1
42,Victor Franz Hess,male,1936,Physics,for his discovery of cosmic radiation,Innsbruck University,Innsbruck,Austria,university,1
43,Carl David Anderson,male,1936,Physics,for his discovery of the positron,California Institute of Technology (Caltech),"Pasadena, CA",United States,university,1
44,Clinton Joseph Davisson,male,1937,Physics,for their experimental discovery of the diffraction of electrons by crystals,Bell Telephone Laboratories,"New York, NY",United States,research_institute,1
45,George Paget Thomson,male,1937,Physics,for their experimental discovery of the diffraction of electrons by crystals,London University,London,United Kingdom,university,1
46,Enrico Fermi,male,1938,Physics,"for his demonstrations of the existence of new radioactive elements produced by neutron irradiation, and for his related discovery of nuclear reactions brought about by slow neutrons",Rome University,Rome,Italy,university,1
47,Ernest Orlando Lawrence,male,1939,Physics,"for the invention and development of the cyclotron and for results obtained with it, especially with regard to artificial radioactive elements",University of California,"Berkeley, CA",United States,university,1
48,Otto Stern,male,1943,Physics,for his contribution to the development of the molecular ray method and his discovery of the magnetic moment of the proton,Carnegie Institute of Technology,"Pittsburgh, PA",United States,university,1
49,Isidor Isaac Rabi,male,1944,Physics,for his resonance method for recording the magnetic properties of atomic nuclei,Columbia University,"New York, NY",United States,university,1
50,Wolfgang Pauli,male,1945,Physics,"for the discovery of the Exclusion Principle, also called the Pauli Principle",Princeton University,"Princeton, NJ",United States,university,1
51,Percy Williams Bridgman,male,1946,Physics,"for the invention of an apparatus to produce extremely high pressures, and for the discoveries he made therewith in the field of high pressure physics",Harvard University,"Cambridge, MA",United States,university,1
52,Sir Edward Victor Appleton,male,1947,Physics,for his investigations of the physics of the upper atmosphere especially for the discovery of the so-called Appleton layer,Department of Scientific and Industrial Research,London,United Kingdom,research_institute,1
53,Patrick Maynard Stuart Blackett,male,1948,Physics,"for his development of the Wilson cloud chamber method, and his discoveries therewith in the fields of nuclear physics and cosmic radiation",Victoria University,Manchester,United Kingdom,university,1
54,Hideki Yukawa,male,1949,Physics,for his prediction of the existence of mesons on the basis of theoretical work on nuclear forces,Columbia University,"New York, NY",United States,university,1
54,Hideki Yukawa,male,1949,Physics,for his prediction of the existence of mesons on the basis of theoretical work on nuclear forces,Kyoto University,Kyoto,Japan,university,1
55,Cecil Frank Powell,male,1950,Physics,for his development of the photographic method of studying nuclear processes and his discoveries regarding mesons made with this method,Bristol University,Bristol,United Kingdom,university,1
56,Sir John Douglas Cockcroft,male,1951,Physics,for their pioneer work on the transmutation of atomic nuclei by artificially accelerated atomic particles,Atomic Energy Research Establishment,"Harwell, Berkshire",United Kingdom,research_institute,1
57,Ernest Thomas Sinton Walton,male,1951,Physics,for their pioneer work on the transmutation of atomic nuclei by artificially accelerated atomic particles,Trinity College,Dublin,Ireland,university,1
58,Felix Bloch,male,1952,Physics,for their development of new methods for nuclear magnetic precision measurements and discoveries in connection therewith,Stanford University,"Stanford, CA",United States,university,1
59,Edward Mills Purcell,male,1952,Physics,for their development of new methods for nuclear magnetic precision measurements and discoveries in connection therewith,Harvard University,"Cambridge, MA",United States,university,1
60,Frits Zernike,male,1953,Physics,"for his demonstration of the phase contrast method, especially for his invention of the phase contrast microscope",Groningen University,Groningen,Netherlands,university,1
61,Max Born,male,1954,Physics,"for his fundamental research in quantum mechanics, especially for his statistical interpretation of the wavefunction",Edinburgh University,Edinburgh,United Kingdom,university,1
62,Walther Bothe,male,1954,Physics,for the coincidence method and his discoveries made therewith,University of Heidelberg,Heidelberg,Germany,university,1
62,Walther Bothe,male,1954,Physics,for the coincidence method and his discoveries made therewith,Max-Planck-Institut für medizinische Forschung,Heidelberg,Germany,other,1
63,Willis Eugene Lamb,male,1955,Physics,for his discoveries concerning the fine structure of the hydrogen spectrum,Stanford University,"Stanford, CA",United States,university,1
64,Polykarp Kusch,male,1955,Physics,for his precision determination of the magnetic moment of the electron,Columbia University,"New York, NY",United States,university,1
65,William Bradford Shockley,male,1956,Physics,for their researches on semiconductors and their discovery of the transistor effect,"Semiconductor Laboratory of Beckman Instruments, Inc.","Mountain View, CA",United States,research_institute,1
66,John Bardeen,male,1956,Physics,for their researches on semiconductors and their discovery of the transistor effect,University of Illinois,"Urbana, IL",United States,university,1
66,John Bardeen,male,1972,Physics,"for their jointly developed theory of superconductivity, usually called the BCS-theory",University of Illinois,"Urbana, IL",United States,university,1
67,Walter Houser Brattain,male,1956,Physics,for their researches on semiconductors and their discovery of the transistor effect,Bell Telephone Laboratories,"Murray Hill, NJ",United States,research_institute,1
68,Chen Ning Yang,male,1957,Physics,for their penetrating investigation of the so-called parity laws which has led to important discoveries regarding the elementary particles,Institute for Advanced Study,"Princeton, NJ",United States,research_institute,1
69,Tsung-Dao (T.D.) Lee,male,1957,Physics,for their penetrating investigation of the so-called parity laws which has led to important discoveries regarding the elementary particles,Columbia University,"New York, NY",United States,university,1
70,Pavel Alekseyevich Cherenkov,male,1958,Physics,for the discovery and the interpretation of the Cherenkov effect,P.N. Lebedev Physical Institute,Moscow,Russia,research_institute,1
71,Igor Yevgenyevich Tamm,male,1958,Physics,for the discovery and the interpretation of the Cherenkov effect,Lomonosov Moscow State University,Moscow,Russia,university,1
71,Igor Yevgenyevich Tamm,male,1958,Physics,for the discovery and the interpretation of the Cherenkov effect,P.N. Lebedev Physical Institute,Moscow,Russia,research_institute,1
72,Emilio Gino Segrè,male,1959,Physics,for their discovery of the antiproton,University of California,"Berkeley, CA",United States,university,1
73,Owen Chamberlain,male,1959,Physics,for their discovery of the antiproton,University of California,"Berkeley, CA",United States,university,1
74,Donald Arthur Glaser,male,1960,Physics,for the invention of the bubble chamber,University of California,"Berkeley, CA",United States,university,1
75,Robert Hofstadter,male,1961,Physics,for his pioneering studies of electron scattering in atomic nuclei and for his thereby achieved discoveries concerning the structure of the nucleons,Stanford University,"Stanford, CA",United States,university,1
76,Rudolf Ludwig Mössbauer,male,1961,Physics,for his researches concerning the resonance absorption of gamma radiation and his discovery in this connection of the effect which bears his name,Technical University,Munich,Germany,university,1
76,Rudolf Ludwig Mössbauer,male,1961,Physics,for his researches concerning the resonance absorption of gamma radiation and his discovery in this connection of the effect which bears his name,California Institute of Technology (Caltech),"Pasadena, CA",United States,university,1
77,Lev Davidovich Landau,male,1962,Physics,"for his pioneering theories for condensed matter, especially liquid helium",Academy of Sciences,Moscow,Russia,university,1
78,Eugene Paul Wigner,male,1963,Physics,"for his contributions to the theory of the atomic nucleus and the elementary particles, particularly through the discovery and application of fundamental symmetry principles",Princeton University,"Princeton, NJ",United States,university,1
79,Maria Goeppert Mayer,female,1963,Physics,for their discoveries concerning nuclear shell structure,University of California,"San Diego, CA",United States,university,1
80,J. Hans D. Jensen,male,1963,Physics,for their discoveries concerning nuclear shell structure,University of Heidelberg,Heidelberg,Germany,university,1
81,Charles Hard Townes,male,1964,Physics,"for fundamental work in the field of quantum electronics, which has led to the construction of oscillators and amplifiers based on the maser-laser principle",Massachusetts Institute of Technology (MIT),"Cambridge, MA",United States,university,1
82,Nicolay Gennadiyevich Basov,male,1964,Physics,"for fundamental work in the field of quantum electronics, which has led to the construction of oscillators and amplifiers based on the maser-laser principle",P.N. Lebedev Physical Institute,Moscow,Russia,research_institute,1
83,Aleksandr Mikhailovich Prokhorov,male,1964,Physics,"for fundamental work in the field of quantum electronics, which has led to the construction of oscillators and amplifiers based on the maser-laser principle",P.N. Lebedev Physical Institute,Moscow,Russia,research_institute,1
84,Sin-Itiro Tomonaga,male,1965,Physics,"for their fundamental work in quantum electrodynamics, with deep-ploughing consequences for the physics of elementary particles",Tokyo University of Education,Tokyo,Japan,university,1
85,Julian Schwinger,male,1965,Physics,"for their fundamental work in quantum electrodynamics, with deep-ploughing consequences for the physics of elementary particles",Harvard University,"Cambridge, MA",United States,university,1
86,Richard P. Feynman,male,1965,Physics,"for their fundamental work in quantum electrodynamics, with deep-ploughing consequences for the physics of elementary particles",California Institute of Technology (Caltech),"Pasadena, CA",United States,university,1
87,Alfred Kastler,male,1966,Physics,for the discovery and development of optical methods for studying Hertzian resonances in atoms,École Normale Supérieure,Paris,France,other,1
88,Hans Albrecht Bethe,male,1967,Physics,"for his contributions to the theory of nuclear reactions, especially his discoveries concerning the energy production in stars",Cornell University,"Ithaca, NY",United States,university,1
89,Luis Walter Alvarez,male,1968,Physics,"for his decisive contributions to elementary particle physics, in particular the discovery of a large number of resonance states, made possible through his development of the technique of using hydrogen bubble chamber and data analysis",University of California,"Berkeley, CA",United States,university,1
90,Murray Gell-Mann,male,1969,Physics,for his contributions and discoveries concerning the classification of elementary particles and their interactions,California Institute of Technology (Caltech),"Pasadena, CA",United States,university,1
91,Hannes Olof Gösta Alfvén,male,1970,Physics,for fundamental work and discoveries in magnetohydro-dynamics with fruitful applications in different parts of plasma physics,Royal Institute of Technology,Stockholm,Sweden,university,1
92,Louis Eugène Félix Néel,male,1970,Physics,for fundamental work and discoveries concerning antiferromagnetism and ferrimagnetism which have led to important applications in solid state physics,University of Grenoble,Grenoble,France,university,1
93,Dennis Gabor,male,1971,Physics,for his invention and development of the holographic method,Imperial College,London,United Kingdom,university,1
95,Leon Neil Cooper,male,1972,Physics,"for their jointly developed theory of superconductivity, usually called the BCS-theory",Brown University,"Providence, RI",United States,university,1
96,John Robert Schrieffer,male,1972,Physics,"for their jointly developed theory of superconductivity, usually called the BCS-theory",University of Pennsylvania,"Philadelphia, PA",United States,university,1
97,Leo Esaki,male,1973,Physics,"for their experimental discoveries regarding tunneling phenomena in semiconductors and superconductors, respectively",IBM Thomas J. Watson Research Center,"Yorktown Heights, NY",United States,research_institute,1
98,Ivar Giaever,male,1973,Physics,"for their experimental discoveries regarding tunneling phenomena in semiconductors and superconductors, respectively",General Electric Company,"Schenectady, NY",United States,company,1
99,Brian David Josephson,male,1973,Physics,"for his theoretical predictions of the properties of a supercurrent through a tunnel barrier, in particular those phenomena which are generally known as the Josephson effects",University of Cambridge,Cambridge,United Kingdom,university,1
100,Sir Martin Ryle,male,1974,Physics,"for their pioneering research in radio astrophysics: Ryle for his observations and inventions, in particular of the aperture synthesis technique, and Hewish for his decisive role in the discovery of pulsars",University of Cambridge,Cambridge,United Kingdom,university,1
101,Antony Hewish,male,1974,Physics,"for their pioneering research in radio astrophysics: Ryle for his observations and inventions, in particular of the aperture synthesis technique, and Hewish for his decisive role in the discovery of pulsars",University of Cambridge,Cambridge,United Kingdom,university,1
102,Aage Niels Bohr,male,1975,Physics,for the discovery of the connection between collective motion and particle motion in atomic nuclei and the development of the theory of the structure of the atomic nucleus based on this connection,Niels Bohr Institute,Copenhagen,Denmark,research_institute,1
103,Ben Roy Mottelson,male,1975,Physics,for the discovery of the connection between collective motion and particle motion in atomic nuclei and the development of the theory of the structure of the atomic nucleus based on this connection,Nordita,Copenhagen,Denmark,other,1
104,Leo James Rainwater,male,1975,Physics,for the discovery of the connection between collective motion and particle motion in atomic nuclei and the development of the theory of the structure of the atomic nucleus based on this connection,Columbia University,"New York, NY",United States,university,1
105,Burton Richter,male,1976,Physics,for their pioneering work in the discovery of a heavy elementary particle of a new kind,Stanford Linear Accelerator Center,"Stanford, CA",United States,research_institute,1
106,Samuel Chao Chung Ting,male,1976,Physics,for their pioneering work in the discovery of a heavy elementary particle of a new kind,Massachusetts Institute of Technology (MIT),"Cambridge, MA",United States,university,1
107,Philip Warren Anderson,male,1977,Physics,for their fundamental theoretical investigations of the electronic structure of magnetic and disordered systems,Bell Telephone Laboratories,"Murray Hill, NJ",United States,research_institute,1
108,Sir Nevill Francis Mott,male,1977,Physics,for their fundamental theoretical investigations of the electronic structure of magnetic and disordered systems,University of Cambridge,Cambridge,United Kingdom,university,1
109,John Hasbrouck Van Vleck,male,1977,Physics,for their fundamental theoretical investigations of the electronic structure of magnetic and disordered systems,Harvard University,"Cambridge, MA",United States,university,1
110,Pyotr Leonidovich Kapitsa,male,1978,Physics,for his basic inventions and discoveries in the area of low-temperature physics,Academy of Sciences,Moscow,Russia,university,1
111,Arno Allan Penzias,male,1978,Physics,for their discovery of cosmic microwave background radiation,Bell Laboratories,"Holmdel, NJ",United States,research_institute,1
112,Robert Woodrow Wilson,male,1978,Physics,for their discovery of cosmic microwave background radiation,Bell Laboratories,"Holmdel, NJ",United States,research_institute,1
113,Sheldon Lee Glashow,male,1979,Physics,"for their contributions to the theory of the unified weak and electromagnetic interaction between elementary particles, including, inter alia, the prediction of the weak neutral current","Harvard University, Lyman Laboratory","Cambridge, MA",United States,university,1
114,Abdus Salam,male,1979,Physics,"for their contributions to the theory of the unified weak and electromagnetic interaction between elementary particles, including, inter alia, the prediction of the weak neutral current",International Centre for Theoretical Physics,Trieste,Italy,research_institute,1
114,Abdus Salam,male,1979,Physics,"for their contributions to the theory of the unified weak and electromagnetic interaction between elementary particles, including, inter alia, the prediction of the weak neutral current",Imperial College,London,United Kingdom,university,1
115,Steven Weinberg,male,1979,Physics,"for their contributions to the theory of the unified weak and electromagnetic interaction between elementary particles, including, inter alia, the prediction of the weak neutral current",Harvard University,"Cambridge, MA",United States,university,1
